{
  "$prototype": "Class",
  "title": "DataSource",
  "description": "A test data source",
  "$defs": {
    "parameters": {
      "url": {
        "identifier": "url",
        "type": { "type": "string" },
        "description": "API endpoint URL",
        "examples": ["https://api.example.com"]
      },
      "limit": {
        "identifier": "limit",
        "type": { "type": "integer", "default": 10 },
        "description": "Max results"
      },
      "debug": {
        "identifier": "debug",
        "type": { "type": "boolean", "default": false },
        "description": "Enable debug mode"
      }
    },
    "fields": {
      "cache": {
        "role": "field",
        "access": "public",
        "scope": "instance",
        "identifier": "cache",
        "type": { "type": "object" },
        "default": {},
        "description": "Internal cache"
      },
      "secret": {
        "role": "field",
        "access": "private",
        "scope": "instance",
        "identifier": "secret"
      }
    },
    "constructor": {
      "role": "constructor",
      "$prototype": "Function",
      "parameters": [{ "$ref": "#/$defs/parameters/url" }]
    }
  }
}
